event_id,catalog,start_time,source_location,note,cme_type,speed,speed_unit,direction,half_angle,latitude,longitude,most_accurate,analysis_time,level_of_data,analysis_type,measurement_pa,measurement_technique,instruments,linked_events,date,year,month,day,hour,day_of_year,quarter,speed_category,potentially_geoeffective
2025-02-11T06:36:00-CME-001,M2M_CATALOG,2025-02-11 06:36:00+00:00,N10E75,"Bright CME visible to the east in SOHO LASCO C2/C3 and in STEREO A COR2. Source is an eruption and associated C5.8 flare located at N15E75. Opening field lines, a rising loop, and ejecta are seen starting at 2025-02-11T06:12Z in SDO AIA 193/171/304/131.",,544.0,km/s,,24.0,10.0,-76.0,True,2025-02-11 12:37:00+00:00,1,C,,SWPC_CAT,"SOHO: LASCO/C2, SOHO: LASCO/C3, STEREO A: SECCHI/COR2",,2025-02-11,2025,2,11,6,42,1,Fast,False
2025-02-11T18:24:00-CME-001,M2M_CATALOG,2025-02-11 18:24:00+00:00,S10E90,"CME seen to the E in SOHO LASCO C2/C3 and STEREO COR2A. The source is best observed in SDO AIA 304 as a filament eruption on the eastern limb around S10E90, beginning around 2025-02-11T17:48Z and erupting more explosively around 2025-02-11T18:04Z. Also observed as field line opening in SDO AIA 171/193, and a C7.2 flare peaking at 2025-02-11T18:25Z.",,650.0,km/s,,37.0,-4.0,-90.0,True,2025-02-11 23:54:00+00:00,0,C,,SWPC_CAT,"SOHO: LASCO/C2, SOHO: LASCO/C3, STEREO A: SECCHI/COR2",2025-02-11T18:05:00-FLR-001,2025-02-11,2025,2,11,18,42,1,Fast,False
2025-02-12T02:48:00-CME-001,M2M_CATALOG,2025-02-12 02:48:00+00:00,N10E70,"CME first seen in the East by SOHO LASCO C2 beginning at 2025-02-12T02:48Z, as well as by SOHO LASCO C3 and STEREO A COR2 in later frames. The source of this event is not entirely clear. However, a region of brightening is visible in SDO AIA 94 located at approx. N10E70 beginning at approx. 12/02:24Z. A 2-coronagraph measurement indicates that the CME likely resulted from activity in this area, however, due to the timing, this brightening may be post-eruptive arcades from an eruption that is not as visible opposed to the actual source of the CME.",,606.0,km/s,,24.0,13.0,-78.0,True,2025-02-12 08:24:00+00:00,0,C,,SWPC_CAT,"SOHO: LASCO/C2, SOHO: LASCO/C3, STEREO A: SECCHI/COR2",,2025-02-12,2025,2,12,2,43,1,Fast,False
2025-02-12T21:48:00-CME-001,M2M_CATALOG,2025-02-12 21:48:00+00:00,,"CME first seen in the East by SOHO LASCO C2 beginning at 20254-02-12T21:48Z, as well as by SOHO LASCO C3 in later frames. This event is not visible in STEREO A COR2 due to a data gap from 2025-02-12T10:38Z to 2025-02-13T03:23Z. There is no clear source seen for this event, aside from general field line movement seen along the East limb in SDO AIA 193.",,554.0,km/s,,15.0,11.0,0.0,True,2025-02-13 04:07:00+00:00,0,C,,Plane-of-sky,"SOHO: LASCO/C2, SOHO: LASCO/C3",,2025-02-12,2025,2,12,21,43,1,Fast,False
2025-02-13T01:36:00-CME-001,M2M_CATALOG,2025-02-13 01:36:00+00:00,,"Faint, narrow CME first seen in the NE by SOHO LASCO C2 beginning at 2025-02-13T01:36Z, as well as by SOHO LASCO C3 in later frames. This event is not visible in STEREO A COR2 due to a data gap from 2025-02-12T10:38Z to 2025-02-13T03:23Z. There is no clear source seen for this event aside from general field line movement along the NE limb seen in SDO AIA 193.",,515.0,km/s,,11.0,21.0,0.0,True,2025-02-13 08:23:00+00:00,0,C,,Plane-of-sky,"SOHO: LASCO/C2, SOHO: LASCO/C3",,2025-02-13,2025,2,13,1,44,1,Fast,False
2025-02-13T15:23:00-CME-001,M2M_CATALOG,2025-02-13 15:23:00+00:00,S07W10,"This CME is visible to the N/NE in SOHO LASCO C2, C3, and STEREO A COR2 imagery. It is very faint with a diffuse front. The potential source of this CME is a dimming centered around S07W10 just East of AR13992 as seen in SDO/AIA 193 and 211 starting around 2025-02-13T14:00Z.",,546.0,km/s,,24.0,23.0,-10.0,True,2025-02-13 21:19:00+00:00,0,C,,SWPC_CAT,"STEREO A: SECCHI/COR2, SOHO: LASCO/C2, SOHO: LASCO/C3",,2025-02-13,2025,2,13,15,44,1,Fast,False
2025-02-13T17:36:00-CME-001,M2M_CATALOG,2025-02-13 17:36:00+00:00,,This CME is visible to the SE in SOHO LASCO C2 and C3 imagery. There is no STEREO A COR2 imagery available for this CME due to a data gap beginning at 2025-02-13T17:09Z. The source of this CME is likely a filament eruption visible in SDO/AIA 304 and 171 just beyond the SE limb starting around 2025-02-13T16:30Z.,,552.0,km/s,,16.0,-57.0,0.0,True,2025-02-13 23:47:00+00:00,0,C,,Plane-of-sky,"SOHO: LASCO/C2, SOHO: LASCO/C3",,2025-02-13,2025,2,13,17,44,1,Fast,False
2025-02-13T21:12:00-CME-001,M2M_CATALOG,2025-02-13 21:12:00+00:00,N20W45,"Narrow, faint CME seen to the northeast in SOHO LASCO C2 during a STEREO A data gap. Likely associated with a small filament eruption starting around 2025-02-13T20:00Z in the NE on Earth-facing disk around N20W45 (seen best in SDO AIA 193).",,531.0,km/s,,10.0,19.0,-54.0,True,2025-02-14 03:06:00+00:00,0,C,,SWPC_CAT,SOHO: LASCO/C2,,2025-02-13,2025,2,13,21,44,1,Fast,False
2025-02-14T08:48:00-CME-001,M2M_CATALOG,2025-02-14 08:48:00+00:00,S21E06,"Wide, faint CME seen primarily to the east in SOHO LASCO C2 and STEREO A COR2 which appears to be associated with a C6.6-class flare from Active Region 13994 and subsequent eruption seen best in SDO AIA 094 and SDO AIA 304 with notable deflection to the east. Despite the overall weak eruptive signature, triangulation strongly suggests that the eruption is associated with front-sided activity bounded by longitudes -25 to -45.",,701.0,km/s,,31.0,-16.0,-32.0,True,2025-02-14 13:21:00+00:00,0,C,,SWPC_CAT,SOHO: LASCO/C2,2025-02-14T07:31:00-FLR-001,2025-02-14,2025,2,14,8,45,1,Fast,False
2025-02-14T14:48:00-CME-001,M2M_CATALOG,2025-02-14 14:48:00+00:00,S12E36,"Jet CME seen to the southeast in SOHO LASCO C2 and STEREO A COR2A likely associated with a minor eruption from Active Region 13991 (S12E36), as evidenced by an eruptive signature taking place in SDO AIA 193.",,592.0,km/s,,10.0,-34.0,-43.0,True,2025-02-14 20:31:00+00:00,0,C,,SWPC_CAT,SOHO: LASCO/C2,,2025-02-14,2025,2,14,14,45,1,Fast,False
2025-02-14T17:48:00-CME-001,M2M_CATALOG,2025-02-14 17:48:00+00:00,S21W00,"Narrow CME seen to the southeast in SOHO LASCO C2 during a STEREO A data gap; the CME is possibly associated with a minor eruption from Active Region 13994 located near S21W00 as seen in SDO AIA 94, 304, though it isn't definitive where the eruption originates. Triangulation is not currently possible due to a STA COR2 data gap.",,628.0,km/s,,13.0,-34.0,0.0,True,2025-02-14 23:43:00+00:00,0,C,,Plane-of-sky,SOHO: LASCO/C2,,2025-02-14,2025,2,14,17,45,1,Fast,False
2025-02-14T21:48:00-CME-001,M2M_CATALOG,2025-02-14 21:48:00+00:00,N14E33,"CME seen to the NE in SOHO LASCO C2/C3 only, STEREO COR2A beacon data entirely misses this event. Partially overlaps with CME 2025-02-14T22:00Z to the SE. The source for this CME is likely an area of the disk ~N14E33 which brightens and releases some filament material to the NE starting around 2025-02-14T20:58Z, best observed in SDO AIA 171/193/304.",,507.0,km/s,,17.0,4.0,-33.0,True,2025-02-15 04:12:00+00:00,0,C,,SWPC_CAT,"SOHO: LASCO/C2, SOHO: LASCO/C3",,2025-02-14,2025,2,14,21,45,1,Fast,False
2025-02-15T01:36:00-CME-001,M2M_CATALOG,2025-02-15 01:36:00+00:00,N11E31,"Fast CME seen  to the NE in both coronagraphs, faint in SOHO LASCO and bright in STEREO A COR2. In STEREO A it is only seen after the nighttime data gap ends. Its source is likely a significant filament eruption centered around N11E31, seen starting around 2025-02-15T00:56Z in GOES SUVI 304 and in SDO AIA 304, but also seen as small area brightening in SDO AIA 193. There is also a lower class C flare associated with it.",,722.0,km/s,,20.0,10.0,-31.0,True,2025-02-15 05:48:00+00:00,0,C,,SWPC_CAT,"SOHO: LASCO/C2, SOHO: LASCO/C3, STEREO A: SECCHI/COR2",2025-02-15T00:50:00-FLR-001,2025-02-15,2025,2,15,1,46,1,Fast,False
2025-02-15T13:25:00-CME-001,M2M_CATALOG,2025-02-15 13:25:00+00:00,,"Bright CME with a high southern latitude, seen to the west in STEREO A COR2 and almost exactly to the south in SOHO LASCO, indicating a backsided source. Coronal signatures include a huge prominence seen directly to the south in GOES SUVI 304 starting at 2025-02-12:56Z and originating behind the south limb, and also seen as an extensive movement of matter/field lines to the south and southeast in GOES SUVI 284, also likely happening behind the southern limb. Coronal signatures are almost not seen in SDO AIA, except for minimal movement of ejecta seen in AIA 304.",,820.0,km/s,,37.0,-43.0,173.0,True,2025-02-15 17:38:00+00:00,0,C,,SWPC_CAT,"SOHO: LASCO/C2, SOHO: LASCO/C3, STEREO A: SECCHI/COR2",,2025-02-15,2025,2,15,13,46,1,Fast,True
2025-02-15T20:36:00-CME-001,M2M_CATALOG,2025-02-15 20:36:00+00:00,N06W90,CME visible to the northwest in SOHO LASCO C2/C3. The CME is partially obscured by the pylon in SOHO LASCO C3. No visible in STEREO A COR2 due to a data gap starting at 2025-02-15T17:09Z. The source is an eruption from Active Region 13983 (approx. N06W90) starting at 2025-02-15T19:22Z. Brightening and opening field lines are best seen in SDO AIA 171/193 and GOES SUVI 284. The eruption is also visible in SDO AIA 304 imagery.,,605.0,km/s,,22.0,39.0,85.0,True,2025-02-16 02:30:00+00:00,0,C,,SWPC_CAT,"SOHO: LASCO/C2, SOHO: LASCO/C3",2025-02-15T19:22:00-FLR-001,2025-02-15,2025,2,15,20,46,1,Fast,False
2025-02-19T19:12:00-CME-001,M2M_CATALOG,2025-02-19 19:12:00+00:00,,"This CME is visible to the NE in SOHO LASCO C2 and C3. There is a data gap in STEREO A COR2 during this event. The source appears to be a filament eruption beyond the NE limb starting around 2025-02-19T18:47Z as seen in SDO/AIA 304, 171, 131, 195, and GOES SUVI 304.",,887.0,km/s,,36.0,62.0,-100.0,True,2025-02-19 23:14:00+00:00,0,C,,SWPC_CAT,"SOHO: LASCO/C2, SOHO: LASCO/C3",,2025-02-19,2025,2,19,19,50,1,Fast,True
2025-02-20T02:00:00-CME-001,M2M_CATALOG,2025-02-20 02:00:00+00:00,,"Loop CME overlapping overlaps CME 2025-02-20T00:36Z which begins as a very narrow event but evolves as a wider event with time, seen to the northeast in SOHO LASCO C2/C3. Likely associated with far-sided activity based on its association with several far-sided events throughout the day, though the source is not known.",,534.0,km/s,,14.0,39.0,0.0,True,2025-02-20 08:19:00+00:00,0,C,,Plane-of-sky,SOHO: LASCO/C2,,2025-02-20,2025,2,20,2,51,1,Fast,False
2025-02-20T06:24:00-CME-001,M2M_CATALOG,2025-02-20 06:24:00+00:00,S45E70,"Narrow CME seen to the south in SOHO LASCO C2 and to the southeast in STEREO A COR2 in association with a large scale filament eruption taking place near S45E70, seen best in SDO AIA 304 and GOES SUVI 304. Liftoff starts around 2025-02-20T04:50Z.",,684.0,km/s,,10.0,-72.0,-44.0,True,2025-02-20 11:31:00+00:00,0,C,,SWPC_CAT,"SOHO: LASCO/C2, SOHO: LASCO/C3",,2025-02-20,2025,2,20,6,51,1,Fast,False
2025-02-20T10:36:00-CME-001,M2M_CATALOG,2025-02-20 10:36:00+00:00,S10E60,"Wide CME seen to the east in SOHO LASCO C2 and STEREO A COR2 composed of a brighter bulk to the south and possibly a separate portion just to the north. Likely associated with large scale dimming taking place near S10E60 seen best in GOES SUVI 195 and SDO AIA 193 starting at 2025-02-20T09:28Z. Triangulation of the leading edge measures a bit closer to the Earth-Sun line than anticipated, and this may be due to a simultaneous eruption occurring near center disk around 2025-02-20T11:00Z.",,621.0,km/s,,22.0,-13.0,-43.0,True,2025-02-20 15:59:00+00:00,0,C,,SWPC_CAT,SOHO: LASCO/C2,2025-02-23T21:20:00-IPS-001,2025-02-20,2025,2,20,10,51,1,Fast,False
2025-02-21T10:12:00-CME-001,M2M_CATALOG,2025-02-21 10:12:00+00:00,,"The first in a series of three overlapping CMEs. This CME is visible to the W/slightly NW in SOHO LASCO C2/C3 and similarly to the W/slightly NW in STEREO A COR2. The leading edge is more faint and narrow than those of the other subsequent CMEs. The source of this CME is part of a complex eruption taking place on the NW limb in SDO imagery. As early as 2025-02-20T18:00Z in SDO AIA 193, a loop over the NW limb can be seen beginning to slowly rise, located above or near some destabilizing filament material hovering above on the NW limb in SDO AIA 304.",,682.0,km/s,,18.0,11.0,86.0,True,2025-02-21 15:33:00+00:00,0,C,,SWPC_CAT,"SOHO: LASCO/C2, SOHO: LASCO/C3, STEREO A: SECCHI/COR2",,2025-02-21,2025,2,21,10,52,1,Fast,False
2025-02-21T11:00:00-CME-001,M2M_CATALOG,2025-02-21 11:00:00+00:00,,"The second in a series of three overlapping CMEs. This CME is visible to the W/slightly NW in SOHO LASCO C2/C3 and similarly to the W/slightly NW in STEREO A COR2. The source of this CME is part of a complex eruption taking place on the NW limb in SDO imagery. At 2025-02-21T09:24Z, a wide loop snaps open in SDO AIA 171/193, and some filamentary material rapidly rises high in the corona but fails to escape solar gravitational forces, remaining suspended in the corona for a few hours. The wide loop that snapped open is a candidate source for this CME.",,766.0,km/s,,25.0,10.0,90.0,True,2025-02-21 15:35:00+00:00,0,C,,SWPC_CAT,"SOHO: LASCO/C2, SOHO: LASCO/C3, STEREO A: SECCHI/COR2",,2025-02-21,2025,2,21,11,52,1,Fast,False
2025-02-21T12:36:00-CME-001,M2M_CATALOG,2025-02-21 12:36:00+00:00,N30W70,"The third in a series of three overlapping CMEs. This bright flux rope CME is visible to the NW in SOHO LASCO C2/C3 and to the NW in STEREO A COR2. The source of this CME is part of a complex eruption taking place on the NW limb in SDO imagery. Around 2025-02-21T11:27Z, suspended filament material finally ejects outward in SDO AIA 171/193/304. A large post-eruptive arcade on the NW limb also begins around 2025-02-21T11:27Z, expanding from N10->N35 on/just inside the NW limb. This filament eruption is also visible in STEREO A EUVI 195 and 304 imagery, showing post-eruptive arcades and brightening stretching from N35W60 to N15W90, near AR 3989 (~N20W85) [30 degrees have been added to all STEREO A EUVI longitudes to translate to Earth-facing disk coordinates].",,985.0,km/s,,26.0,24.0,72.0,True,2025-02-21 16:06:00+00:00,0,C,,SWPC_CAT,"SOHO: LASCO/C2, SOHO: LASCO/C3, STEREO A: SECCHI/COR2",,2025-02-21,2025,2,21,12,52,1,Fast,True
2025-02-21T22:36:00-CME-001,M2M_CATALOG,2025-02-21 22:36:00+00:00,,"A loop CME seen to the northwest in SOHO LASCO but partially obscured by pylon in C3 and covered by the 202-02-21T15:53Z-2025-02-22T03:23Z gap in STEREO A COR2. The source is likely a minor activity close to the NW limb (possibly in AR 3989 located at N19W90 at the time on in AR 4001 that is also close to the NW limb), manifesting as the opening/movement of field lines on/close to the NW limb that is seen in SDO AIA 193/171 and GOES SUVI 284 EUV imagery.",,565.0,km/s,,21.0,33.0,90.0,True,2025-02-22 04:40:00+00:00,0,C,,SWPC_CAT,"SOHO: LASCO/C2, SOHO: LASCO/C3",,2025-02-21,2025,2,21,22,52,1,Fast,False
2025-02-23T02:36:00-CME-001,M2M_CATALOG,2025-02-23 02:36:00+00:00,N25W82,"CME seen to the northwest associated with an M4.9-class flare from AR 14001 which peaked at 2025-02-23T02:13Z at N25W82. Beginning around 2025-02-23T02:09Z, wide opening field lines and small post-eruptive arcades are observed in SDO AIA 171/193. First of three CMEs emanating from this area including the faster 02:48Z CME and slower/outflow-related 03:24Z CME.",,517.0,km/s,,29.0,37.0,82.0,True,2025-02-23 09:32:00+00:00,0,C,,SWPC_CAT,"SOHO: LASCO/C2, SOHO: LASCO/C3, STEREO A: SECCHI/COR2",2025-02-23T02:00:00-FLR-001,2025-02-23,2025,2,23,2,54,1,Fast,False
2025-02-23T02:48:00-CME-001,M2M_CATALOG,2025-02-23 02:48:00+00:00,N25W82,"Very fast and thin CME seen to the northwest in SOHO LASCO C2 and STEREO A COR2 out ahead of the 2025-02-23T03:24Z CME seen to the northwest in SOHO LASCO C2 imagery; the source is likely associated with an M4.9-class flare from AR 4001 which peaked at 2025-02-23T02:13Z at N25W82 (14001). Beginning around 2025-02-23T02:09Z, wide opening field lines and small post-eruptive arcade are seen in SDO AIA 171/193.",,1414.0,km/s,,12.0,54.0,83.0,True,2025-02-23 05:12:00+00:00,0,O,,SWPC_CAT,"SOHO: LASCO/C2, SOHO: LASCO/C3, STEREO A: SECCHI/COR2",,2025-02-23,2025,2,23,2,54,1,Very Fast,True
2025-02-23T03:24:00-CME-001,M2M_CATALOG,2025-02-23 03:24:00+00:00,,"Likely outflow associated with CME: 2025-02-23T02:36Z, an eruption associated with an M4.9-class flare from AR 14001 which peaked at 2025-02-23T02:13Z at N25W82. Beginning around 2025-02-23T02:09Z, wide opening field lines and small post-eruptive arcade are observed in SDO AIA 171/193. Triangulation with STEREO Ahead suggests the eruption is sourced around W55 but this is not supported by EUV imagery.",,524.0,km/s,,16.0,51.0,83.0,True,2025-02-23 10:32:00+00:00,0,C,,SWPC_CAT,"SOHO: LASCO/C2, SOHO: LASCO/C3",,2025-02-23,2025,2,23,3,54,1,Fast,False
2025-02-23T13:48:00-CME-001,M2M_CATALOG,2025-02-23 13:48:00+00:00,,Narrow jet CME seen to the southeast in SOHO LASCO C2; the source may be loose field line movement over AR 4004 (S15E65 at this time) starting around 2025-02-23T10:15Z in SDO AIA 193 but confidence is low.,,637.0,km/s,,10.0,-22.0,0.0,True,2025-02-23 19:25:00+00:00,0,C,,Plane-of-sky,"SOHO: LASCO/C2, SOHO: LASCO/C3",,2025-02-23,2025,2,23,13,54,1,Fast,False
2025-02-23T19:36:00-CME-001,M2M_CATALOG,2025-02-23 19:36:00+00:00,N25W87,"Very wide CME seen to the northwest in SOHO LASCO C2 and C3 during a STEREO A COR2A data gap composed with a well-defined western and southwestern leading edge and not-as-defined northern leading edge, associated with an X2.0-class flare and subsequent eruption from AR 14001 (N25W87) as evidenced by strong brightening in SDO AIA 131 and quickly separating field lines seen in SDO AIA 193, 171 and GOES SUVI 284.",,1309.0,km/s,,49.0,31.0,39.0,True,2025-02-23 22:27:00+00:00,0,O,,SWPC_CAT,"SOHO: LASCO/C2, SOHO: LASCO/C3",2025-02-23T19:22:00-FLR-001,2025-02-23,2025,2,23,19,54,1,Very Fast,True
2025-02-24T02:12:00-CME-001,M2M_CATALOG,2025-02-24 02:12:00+00:00,,Very faint CME to the SE in SOHO LASCO C2 and C3. Not clearly seen in STEREO A COR2 imagery. The source may be moving/opening field lines along the southern limb as seen in SDO/AIA 193 starting around 2025-02-24T00:12Z.,,632.0,km/s,,16.0,-48.0,0.0,True,2025-02-24 08:04:00+00:00,0,C,,Plane-of-sky,"SOHO: LASCO/C2, SOHO: LASCO/C3",,2025-02-24,2025,2,24,2,55,1,Fast,False
2025-02-24T06:00:00-CME-001,M2M_CATALOG,2025-02-24 06:00:00+00:00,,"Bright, wide CME seen to the NW in SOHO LASCO C2/C3 and STEREO COR2A. Source is seen in SDO AIA 171/193/211 as field line movement beginning around 2025-02-24T04:09Z over the NW limb, with an EUV wave at 2025-02-24T15:18Z, and as a filament liftoff starting around 2025-02-24T05:06Z. The source is better seen in STEREO A EUVI with the filament on/just inside the west limb as viewed from STEREO A. At 2025-02-24T05:15Z, STEREO A was located 30.297 degrees from Earth, putting its west limb around W120.3. Here in STEREO A EUVI 304, the filament can be seen slowly rising starting at 2025-02-24T03:15Z->T5:15Z, and ejecting by the next timestamp at T05:45Z. A post-eruptive arcade follows in STEREO A EUVI 195/304. The source could be, or be near, old AR 3989, which rotated off the west limb on 2025-02-21 and would be located approximately W115-W125.",,1421.0,km/s,,41.0,24.0,110.0,True,2025-02-24 08:35:00+00:00,0,O,,SWPC_CAT,"SOHO: LASCO/C2, SOHO: LASCO/C3, STEREO A: SECCHI/COR2",,2025-02-24,2025,2,24,6,55,1,Very Fast,True
2025-02-24T07:00:00-CME-001,M2M_CATALOG,2025-02-24 07:00:00+00:00,N17W21,CME first seen to the WNW is SOHO LASCO C2. CME is also seen as a partial halo mostly to the NW in STEREO A COR2 but is obscured by the pylon is SOHO LASCO C3. This CME is very difficult to distinguish from the previous CME in white light imagery. The source is most likely associated with an M3.3 flare from AR 14000 (N17W21) that peaked at 2025-02-24T07:02Z. The flare and a region of dimming projected south of the flare are seen across SDO AIA and GOES SUVI wavelengths but are best seen in SDO AIA 193. There also appears to be some western deflection.,,593.0,km/s,,45.0,13.0,29.0,True,2025-02-24 12:11:00+00:00,0,C,,SWPC_CAT,"SOHO: LASCO/C2, STEREO A: SECCHI/COR2","2025-02-24T06:53:00-FLR-001, 2025-02-26T05:26:00-IPS-001, 2025-02-27T09:00:00-GST-001",2025-02-24,2025,2,24,7,55,1,Fast,False
2025-02-24T21:24:00-CME-001,M2M_CATALOG,2025-02-24 21:24:00+00:00,S13W120,"This CME is first seen to the W in SOHO LASCO C2 and C3, but not in STEREO A COR2 due to a data gap beginning at 2025-02-24T20:23Z. The source of this CME is likely associated with an eruption visible beyond the SW limb starting around 2025-02-24T20:27Z as seen in SDO/AIA 131 with associated brightening, moving/opening field lines, and an EUV wave best seen in SDO/AIA 211. Following the eruption, there were very notably post-eruptive arcades which were associated with a long duration, occulted M3.9 flare from former AR 13990 (S13W120) that peaked at 2024-02-24T23:02Z. The very beginning of the flare can be seen in STEREO A EUVI 195 on the W limb in the last frame (2025-02-24T20:35Z) prior to the end of a downlink period. Additionally, very fast opening field lines are visible from beyond the W limb starting around 2025-02-24T20:24Z in SDO/AIA 193, SDO/AIA 171, GOES SUVI 195, and GOES SUVI 284.",,1627.0,km/s,,51.0,-2.0,153.0,True,2025-02-25 00:18:00+00:00,0,O,,SWPC_CAT,"SOHO: LASCO/C2, SOHO: LASCO/C3","2025-02-24T21:50:00-FLR-001, 2025-02-25T00:11:00-SEP-001, 2025-02-25T00:17:00-SEP-001, 2025-02-25T00:20:00-SEP-001, 2025-02-25T00:42:00-SEP-001, 2025-02-25T03:05:00-SEP-001, 2025-02-25T03:52:00-SEP-001",2025-02-24,2025,2,24,21,55,1,Very Fast,True
2025-02-25T12:38:00-CME-001,M2M_CATALOG,2025-02-25 12:38:00+00:00,S15W55,"Bright CME first seen in the SW by STEREO A COR2 beginning at 2025-02-25T12:38Z, as well as by SOHO LASCO C2/C3 in later frames. The beginning frames of this event in SOHO LASCO are obscured by a data gap from 25/11:12Z to 25/13:39Z. The source of this CME is an M3.6 flare from AR 3998 (S15W55) as seen in SDO AIA 131. Opening field lines are also visible in SDO AIA 94, 171 and 193, along with an area of dimming seen in SDO AIA 94, 193, 211 and STEREO A EUVI 195.",,627.0,km/s,,37.0,-20.0,53.0,True,2025-02-25 17:49:00+00:00,0,C,,SWPC_CAT,"STEREO A: SECCHI/COR2, SOHO: LASCO/C3","2025-02-25T11:20:00-FLR-001, 2025-02-28T08:30:00-IPS-001",2025-02-25,2025,2,25,12,56,1,Fast,False
2025-02-25T15:48:00-CME-001,M2M_CATALOG,2025-02-25 15:48:00+00:00,,"Faint CME to the NW in SOHO LASCO C2/C3 only, missed in STEREO COR2A due to a data gap. The CME travels into the pylon in C3 hindering visibility in white light and running difference imagery. The source is observed as a field line loop breaking over the NW limb around 2025-02-25T14:18Z in SDO AIA 171/193, potentially from old AR 4001 which rotated over the NW limb on 2025-02-24.",,741.0,km/s,,18.0,51.0,0.0,True,2025-02-25 20:58:00+00:00,0,C,,Plane-of-sky,"SOHO: LASCO/C2, SOHO: LASCO/C3",,2025-02-25,2025,2,25,15,56,1,Fast,False
2025-02-26T06:48:00-CME-001,M2M_CATALOG,2025-02-26 06:48:00+00:00,S10W25,"CME first seen in the West by SOHO LASCO C2 beginning at 2025-02-26T06:48Z, as well as by SOHO LASCO C3 in later frames. This CME is not clearly visible in STEREO A COR2. The source of this event is a filament eruption centered at approx. S10W25 exhibiting a strong Westward deflection. This filament is visible in SDO AIA and STEREO A EUVI 304, along with dimming and post eruptive arcades seen in SDO AIA 94, 193 and STEREO A EUVI 195. A large North-South configured coronal hole is visible approximately 10 degrees to the East of the eruptive source. This coronal hole may cause deflection or acceleration of this CME.",,1575.0,km/s,,11.0,-3.0,27.0,True,2025-02-26 08:09:00+00:00,0,O,,SWPC_CAT,"SOHO: LASCO/C2, SOHO: LASCO/C3",2025-02-28T19:32:00-IPS-001,2025-02-26,2025,2,26,6,57,1,Very Fast,True
2025-02-26T15:00:00-CME-001,M2M_CATALOG,2025-02-26 15:00:00+00:00,S30W70,"Bright CME first seen to the SW in SOHO LASCO C2, C3, and after a data gap in STEREO A COR2 imagery. The source of this CME is a filament eruption seen near S30W70 in SDO/AIA, STEREO A EUVI and GOES SUVI 304 starting around 2025-02-26T14:00Z. There is strong southern deflection of the eruption, likely due to the large coronal holes to the north and east of the source location. Field line opening is also visible in SDO/AIA 171, 193, and 211.",,648.0,km/s,,27.0,-54.0,83.0,True,2025-02-26 20:57:00+00:00,0,C,,SWPC_CAT,"SOHO: LASCO/C2, SOHO: LASCO/C3, STEREO A: SECCHI/COR2",,2025-02-26,2025,2,26,15,57,1,Fast,False
2025-02-26T15:12:00-CME-001,M2M_CATALOG,2025-02-26 15:12:00+00:00,,"Faint CME visible to the W/SW in SOHO LASCO C2/C3 and in a few frames of STEREO A COR2 imagery before a data gap beginning around 2025-02-26T19:00Z. The exact start time of this CME is unclear due to the overlap with the CME first seen in SOHO LASCO C2 at 2025-02-26T15:00Z. The possible source of this CME is a filament eruption beginning around 2025-02-26T11:15Z in STEREO A EUVI, GOES SUVI, and SDO/AIA 304 imagery near ~S15W90+. A slow rising loop is visible in GOES SUVI 304 and 284 imagery along the W/SW limb starting around 2025-02-26T12:00Z which may have been fully released from the lower/middle corona when the filament eruption associated with the overlapping CME to the SW occurred.",,829.0,km/s,,20.0,-9.0,119.0,True,2025-02-26 20:50:00+00:00,0,C,,SWPC_CAT,"SOHO: LASCO/C2, SOHO: LASCO/C3, STEREO A: SECCHI/COR2",,2025-02-26,2025,2,26,15,57,1,Fast,True
