event_id,catalog,start_time,source_location,note,cme_type,speed,speed_unit,direction,half_angle,latitude,longitude,most_accurate,analysis_time,level_of_data,analysis_type,measurement_pa,measurement_technique,instruments,linked_events,date,year,month,day,hour,day_of_year,quarter,speed_category,potentially_geoeffective
2023-07-27T21:36:00-CME-001,M2M_CATALOG,2023-07-27 21:36:00+00:00,,"Source is rising loops and widely opening field lines seen beyond the northeast limb in SDO AIA 171/193 at 2023-07-27T20:18Z and disappearing field lines in SDO AIA 304 at 2023-07-27T21:09Z. Opening field lines are seen in GOES SUVI 284/195/304 on or just beyond the eastern limb starting at 2023-07-27T21:12Z. There was also small ejecta originating from on or just beyond the eastern limb as seen in SDO AIA 171/304 starting at 2023-07-27T21:22Z in both wavelengths. Interestingly, post-eruptive arcades are observed farther north, and definitively on the disk located at about N20E75 (AR13388) starting at 2023-07-27T22:48Z in SDO AIA 304, but also seen in SDO AIA 171/193. This CME is measured with an approximated longitude due to a lack of stereoscopic viewpoints.",,680.0,km/s,,51.0,16.0,-110.0,True,2023-07-28 03:15:00+00:00,1,C,,SWPC_CAT,"SOHO: LASCO/C2, SOHO: LASCO/C3, STEREO A: SECCHI/COR2",,2023-07-27,2023,7,27,21,208,3,Fast,False
2023-07-27T23:24:00-CME-001,M2M_CATALOG,2023-07-27 23:24:00+00:00,S25E75,"Possible CME associated with the M-class flare from AR 13388 (S25E75) and the associated relatively minor eruption with dimming and post-eruptive arcades, as well as opening of field lines on the SE limb seen in AIA 193 starting after ~2023-07-27T22Z. This CME is measured with an approximated longitude due to a lack of stereoscopic viewpoints.",,590.0,km/s,,31.0,-25.0,-75.0,True,2023-07-28 04:43:00+00:00,0,C,,SWPC_CAT,"SOHO: LASCO/C2, SOHO: LASCO/C3, STEREO A: SECCHI/COR2",2023-07-27T22:04:00-FLR-001,2023-07-27,2023,7,27,23,208,3,Fast,False
2023-07-28T15:53:00-CME-001,M2M_CATALOG,2023-07-28 15:53:00+00:00,N25W99,Fast CME in the NW following the associated M-class flare from AR3376 (N25W99) and the associated bright magnificent eruption seen just behind the limb in AIA 131/304/193 in the NW starting around 2023-07-28T15:45Z. We can see the rotating flux rope in coronagraph. This CME is measured with an approximated longitude due to a lack of stereoscopic viewpoints.,,2000.0,km/s,,43.0,40.0,110.0,True,2023-07-28 17:35:00+00:00,1,R,,SWPC_CAT,"STEREO A: SECCHI/COR2, SOHO: LASCO/C2, SOHO: LASCO/C3","2023-07-28T15:39:00-FLR-001, 2023-07-28T18:12:00-SEP-001, 2023-07-28T19:05:00-SEP-001, 2023-07-28T19:19:00-SEP-001, 2023-07-28T19:23:00-SEP-001, 2023-07-28T23:50:00-SEP-001, 2023-07-29T00:53:00-SEP-001",2023-07-28,2023,7,28,15,209,3,Extreme,True
2023-07-28T22:36:00-CME-001,M2M_CATALOG,2023-07-28 22:36:00+00:00,N25E25,Asymmetric partial halo CME seen directed primarily towards the east in SOHO LASCO C2/C3 and STEREO A COR2. Source is a filament eruption centered around N25E25 with liftoff starting around 2023-07-28T21:10Z in SDO AIA 304. Dimming can be seen in SDO AIA 193. This eruption is also seen in STEREO A EUV and COR2 imagery after a data gap from 2023-07-28T20:05Z to 2023-07-29T01:05Z.,,589.0,km/s,,42.0,-3.0,-27.0,True,2023-07-29 04:38:00+00:00,0,C,,SWPC_CAT,"SOHO: LASCO/C2, SOHO: LASCO/C3, STEREO A: SECCHI/COR2","2023-08-01T06:00:00-IPS-001, 2023-08-01T10:08:00-IPS-001",2023-07-28,2023,7,28,22,209,3,Fast,False
2023-07-29T07:53:00-CME-001,M2M_CATALOG,2023-07-29 07:53:00+00:00,N15E90,"CME visible in the NE of SOHO LASCO C2/C3 and STEREO A COR2. Source is likely a C6.7 flare peaking at 2023-07-29T07:34Z on the NE limb. Eruption is not clearly visible in SDO AIA imagery due to a data gap from an eclipse from approximately 2023-07-29T06:45Z-07:50Z, but can be seen in GOES SUVI 195 as opening field lines, EUV wave, and post eruption arcades, opening field lines and post eruption arcades in GOES SUVI 171, and an eruption of material in GOES SUVI 304. The eruption is also seen on the NE limb in STEREO A EUV 195 imagery.",,526.0,km/s,,32.0,9.0,-88.0,True,2023-07-29 14:07:00+00:00,0,C,,SWPC_CAT,"STEREO A: SECCHI/COR2, SOHO: LASCO/C2, SOHO: LASCO/C3",2023-07-29T06:55:00-FLR-001,2023-07-29,2023,7,29,7,210,3,Fast,False
2023-07-30T17:12:00-CME-001,M2M_CATALOG,2023-07-30 17:12:00+00:00,,"This CME is visible to the SW in SOHO LASCO C2/C3 and STEREO A COR2 imagery. The source is an eruption and opening of field lines visible just beyond the SW limb in SDO AIA 131, 171, 193 and 304 imagery which start to open around 2023-07-30T16:20Z.",,549.0,km/s,,31.0,-52.0,99.0,True,2023-07-30 23:36:00+00:00,0,C,,SWPC_CAT,"SOHO: LASCO/C2, SOHO: LASCO/C3, STEREO A: SECCHI/COR2",,2023-07-30,2023,7,30,17,211,3,Fast,False
2023-07-31T23:36:00-CME-001,M2M_CATALOG,2023-07-31 23:36:00+00:00,N10E05,"This CME is first seen to the NE in SOHO LASCO C2 at 2023-07-31T23:36Z in both white light and difference imagery. The source of this CME is likely the northern portion (from N15 to S10) of a filament which erupted at central meridian and seems to have deflected to the NE as seen in UV imagery. The northern portion of the filament seems to lift off at about 2023-07-31T17:30Z, as seen in SDO AIA 304 (though, it is difficult to discern exact time due to having only a face-on view of the solar disk). This CME overlaps with a prior CME which likely has a source on the far side of the solar disk.",,636.0,km/s,,19.0,10.0,-23.0,True,2023-08-01 04:05:00+00:00,0,C,,SWPC_CAT,"SOHO: LASCO/C2, SOHO: LASCO/C3","2023-08-04T05:30:00-IPS-001, 2023-08-04T06:52:00-IPS-001",2023-07-31,2023,7,31,23,212,3,Fast,False
2023-08-01T00:12:00-CME-001,M2M_CATALOG,2023-08-01 00:12:00+00:00,N21E16,"Faint possibly partial halo CME seen to the NE in SOHO LASCO not seen in STEREO COR2A as it is fully covered by the nighttime STEREO data gap. A possible source could be what is likely a filament eruption near Active Region 13387, marked by dimming in AIA 193 but with rising post-eruptive arcades seen in AIA 94/335.",,564.0,km/s,,37.0,5.0,-32.0,True,2023-08-01 06:40:00+00:00,0,C,,SWPC_CAT,"SOHO: LASCO/C2, SOHO: LASCO/C3",,2023-08-01,2023,8,1,0,213,3,Fast,False
2023-08-01T12:36:00-CME-001,M2M_CATALOG,2023-08-01 12:36:00+00:00,N10W11,"Faint and fast narrow CME in the NW. No definitive source has been found but it could be a relatively minor eruption in Active Region 13386 (N10W11) starting ~2023-08-01T10:30Z, with dimming and high post eruptive arcades seen in AIA 193 imagery.",,1369.0,km/s,,11.0,17.0,22.0,True,2023-08-01 14:30:00+00:00,0,O,,SWPC_CAT,"SOHO: LASCO/C2, SOHO: LASCO/C3, STEREO A: SECCHI/COR2",,2023-08-01,2023,8,1,12,213,3,Very Fast,True
2023-08-02T09:12:00-CME-001,M2M_CATALOG,2023-08-02 09:12:00+00:00,,"This CME is seen as a halo CME with a bulk portion seen more predominantly to the west in SOHO LASCO C2, C3, and STEREO A COR2 imagery. The more full halo portion is fairly faint in coronagraph imagery. The source of this CME is an S-shaped filament eruption stretching from roughly N10 to S15. There is clear dimming associated with this source as seen in SDO/AIA 193 starting around 2023-08-02T08:00Z. This dimming stretches from W10 to W30 within the N10 to S15 latitudes.",,759.0,km/s,,42.0,-4.0,26.0,True,2023-08-02 13:43:00+00:00,0,C,,SWPC_CAT,"SOHO: LASCO/C2, SOHO: LASCO/C3, STEREO A: SECCHI/COR2","2023-08-05T02:10:00-IPS-001, 2023-08-05T03:00:00-GST-001, 2023-08-05T04:57:00-IPS-001, 2023-08-09T15:20:00-RBE-001, 2023-08-11T13:05:00-RBE-001",2023-08-02,2023,8,2,9,214,3,Fast,False
2023-08-04T04:17:00-CME-001,M2M_CATALOG,2023-08-04 04:17:00+00:00,N12W46,"First of two CMEs seen to the N and W in SOHO/STEREO A imagery in association with a long duration M1.9-class flare near the vicinity of AR13386 (N12W46) and a complex, sympathetic eruptive signature before/after the flare. This CME is directed more northward than the latter CME, appearing bulbous with a protruding leading edge and a wide/faint shock seen predominantly to the N and NE. The eruptive signature is characterized by an erupting/disappearing loop starting around 04:04Z seen best in SDO 171 occurring before the M1.9-class flare as well as opening magnetic field lines off the western limb. SDO 304 shows a near-simultaneous filamentary surge north of the flaring Active Region 3386 and south and east, towards the direction of the observing spacecraft, starting around 03:55Z, followed by a minor sympathetic filament liftoff closer to 05:30Z. SDO 193 shows three distinct areas of dimming: NW and SE of the active region during and occurring with the flare, then sympathetic dimming N and E of the AR in association with the northern filament surge.",,865.0,km/s,,41.0,13.0,47.0,True,2023-08-04 08:02:00+00:00,0,C,,SWPC_CAT,"SOHO: LASCO/C2, SOHO: LASCO/C3, STEREO A: SECCHI/COR2","2023-08-04T03:38:00-FLR-001, 2023-08-07T01:15:00-IPS-001, 2023-08-11T13:05:00-RBE-001",2023-08-04,2023,8,4,4,216,3,Fast,True
2023-08-04T04:49:00-CME-001,M2M_CATALOG,2023-08-04 04:49:00+00:00,N12W46,"Second of two CMEs seen to the north and west in SOHO/STEREO A imagery starting around 2023-08-04T04:17Z which is inferred to be in association with a long duration M1.9-class solar flare near the vicinity of Active Region 3386 (N12W46) due to the complex, sympathetic eruptive signature containing multiple areas of dimming. The CME front seen first near 2023-08-04T04:49Z appears to be embedded within the first, and is directed more westerly. The overall eruptive signature is characterized by an erupting/disappearing loop starting around 04:04Z near the vicinity of Active Region 3386 seen best in SDO 171 occurring before the M1.9-class flare as well as opening magnetic field lines off the western limb seen in this wavelength. SDO 304 shows a near-simultaneous filamentary surge north of the flaring Active Region 3386 and south and east, towards the direction of the observing spacecraft, starting around 03:55Z, followed by a minor sympathetic filament liftoff closer to 05:30Z. SDO 193 shows three distinct areas of dimming: northwest and southeast of the Active Region during and occurring with the flare, then sympathetic dimming north and east of the Active Region in association with the northern filament surge.",,543.0,km/s,,37.0,9.0,45.0,True,2023-08-04 11:12:00+00:00,0,C,,SWPC_CAT,"SOHO: LASCO/C2, SOHO: LASCO/C3, STEREO A: SECCHI/COR2","2023-08-04T03:38:00-FLR-001, 2023-08-07T01:15:00-IPS-001, 2023-08-11T13:05:00-RBE-001",2023-08-04,2023,8,4,4,216,3,Fast,False
2023-08-05T07:12:00-CME-001,M2M_CATALOG,2023-08-05 07:12:00+00:00,S10W68,"Wide CME seen to the south and west in SOHO and STEREO A associated with a long duration M1.6-class solar flare and erupting filament occurring near S10W68. The faint shock presents a full halo with preference towards the west. The event was not captured in SDO EUV imagery due to an ongoing eclipse, however, GOES SUVI detected the event. Around 2023-08-05T06:45Z, a dark filament near the western portion of the disk is seen lifting off, becoming a bright structure as it leaves the disk towards the west.",,1044.0,km/s,,46.0,-17.0,63.0,True,2023-08-05 10:28:00+00:00,0,O,,SWPC_CAT,"SOHO: LASCO/C2, SOHO: LASCO/C3, STEREO A: SECCHI/COR2","2023-08-05T06:18:00-FLR-001, 2023-08-05T10:00:00-SEP-001, 2023-08-05T10:19:00-SEP-001, 2023-08-05T10:47:00-SEP-001, 2023-08-05T10:59:00-SEP-001, 2023-08-05T11:15:00-SEP-001, 2023-08-05T12:33:00-SEP-001, 2023-08-07T08:46:00-IPS-001, 2023-08-07T11:07:00-IPS-001",2023-08-05,2023,8,5,7,217,3,Very Fast,True
2023-08-05T22:24:00-CME-001,M2M_CATALOG,2023-08-05 22:24:00+00:00,N11W75,"Partial halo CME visible in the west of SOHO LASCO C2/C3. STEREO A COR2 imagery not available at the start of this CME. Associated with a X1.6 flare and eruption from AR 3386 (N11W75) with opening field lines, an EUV wave, and post-eruptive arcades best seen in SDO AIA 171/193.",,1757.0,km/s,,49.0,23.0,75.0,True,2023-08-06 00:16:00+00:00,0,O,,SWPC_CAT,"SOHO: LASCO/C2, SOHO: LASCO/C3","2023-08-05T10:00:00-SEP-001, 2023-08-05T10:19:00-SEP-001, 2023-08-05T10:47:00-SEP-001, 2023-08-05T11:15:00-SEP-001, 2023-08-05T21:45:00-FLR-001",2023-08-05,2023,8,5,22,217,3,Very Fast,True
2023-08-06T04:00:00-CME-001,M2M_CATALOG,2023-08-06 04:00:00+00:00,,"CME seen in the west of SOHO LASCO C2/C3 and STEREO A COR2. No source location was found in available EUV imagery, so the CME is likely backsided.",,747.0,km/s,,25.0,-1.0,0.0,True,2023-08-06 09:12:00+00:00,0,C,,Plane-of-sky,"SOHO: LASCO/C2, SOHO: LASCO/C3, STEREO A: SECCHI/COR2",,2023-08-06,2023,8,6,4,218,3,Fast,False
2023-08-06T18:48:00-CME-001,M2M_CATALOG,2023-08-06 18:48:00+00:00,N11W90,Bright CME visible in the west of SOHO LASCO C2/C3 and STEREO A COR2. Source is an M5.5 flare and eruption from AR 3386 (N11W90) peaking at 2023-08-06T18:40Z. The eruption is characterized by opening field lines and an EUV wave best seen in SDO AIA 171/193 and GOES SUVI 171/195/284.,,1260.0,km/s,,35.0,-15.0,90.0,True,2023-08-06 21:41:00+00:00,0,O,,SWPC_CAT,"SOHO: LASCO/C2, SOHO: LASCO/C3, STEREO A: SECCHI/COR2",2023-08-06T18:20:00-FLR-001,2023-08-06,2023,8,6,18,218,3,Very Fast,True
2023-08-07T05:00:00-CME-001,M2M_CATALOG,2023-08-07 05:00:00+00:00,N10W95,CME visible in the west of SOHO LASCO C2/C3 and STEREO A COR2. Associated with M2.4 flare visible in SDO AIA 131 from AR 3886 which has recently rotated just beyond the west limb of the Earth-facing disk. Eruption is visible as opening field lines in SDO AIA 171/193.,,620.0,km/s,,29.0,-9.0,95.0,True,2023-08-07 10:32:00+00:00,0,C,,SWPC_CAT,"SOHO: LASCO/C2, SOHO: LASCO/C3, STEREO A: SECCHI/COR2",2023-08-07T04:29:00-FLR-001,2023-08-07,2023,8,7,5,219,3,Fast,False
2023-08-07T15:09:00-CME-001,M2M_CATALOG,2023-08-07 15:09:00+00:00,N20W70,"Narrow CME seen to the west of STEREO A COR2 and SOHO LASCO C2/C3. One of several eruptions with CMEs visible in the coronagraph from AR 3387 (approx. N20W70D), with eruption occurring around 2023-08-07T14:36Z in SDO AIA 193/304 and GOES SUVI 304 imagery.",,608.0,km/s,,17.0,-2.0,75.0,True,2023-08-07 20:47:00+00:00,0,C,,SWPC_CAT,"STEREO A: SECCHI/COR2, SOHO: LASCO/C2, SOHO: LASCO/C3",,2023-08-07,2023,8,7,15,219,3,Fast,False
2023-08-07T16:09:00-CME-001,M2M_CATALOG,2023-08-07 16:09:00+00:00,N20W75,"Narrow CME seen in the west of SOHO LASCO C2/C3 and STEREO A COR2. This CME overlaps with CME: 2023-08-07T15:09Z and CME 2023-08-07T16:39Z in the coronagraphs, and all are believed to be from eruptions from AR 3387. Source is likely an M1.0 flare from the AR starting around 2023-08-07T15:30Z. Eruption can be best seen in GOES SUVI 304 as eruptive material leaving the disk.",,680.0,km/s,,23.0,-2.0,75.0,True,2023-08-07 21:05:00+00:00,0,C,,SWPC_CAT,"SOHO: LASCO/C2, SOHO: LASCO/C3, STEREO A: SECCHI/COR2",2023-08-07T15:30:00-FLR-001,2023-08-07,2023,8,7,16,219,3,Fast,False
2023-08-07T16:39:00-CME-001,M2M_CATALOG,2023-08-07 16:39:00+00:00,N20W75,This CME is part of a series of eruptions from AR 3387 (approx. N20W70) seen in SDO AIA and GOES SUVI 304 and may be associated with one of the double-peaked M1.0 class flare from the region. This CME follows CMEs first seen at 2023-08-07T15:09Z and 2023-08-07T16:09Z in the coronagraphs.,,522.0,km/s,,19.0,-2.0,75.0,True,2023-08-07 23:17:00+00:00,0,C,,SWPC_CAT,"SOHO: LASCO/C2, SOHO: LASCO/C3, STEREO A: SECCHI/COR2",,2023-08-07,2023,8,7,16,219,3,Fast,False
2023-08-07T20:48:00-CME-001,M2M_CATALOG,2023-08-07 20:48:00+00:00,N11W90,"No STEREO A data currently. The source is an X1.5 class flare from AR13386 (N11W90) possibly further beyond the limb. There is a clear rising loop in SDO/AIA 131 as the flare begins with a distinct EUV wave in SDO/AIA 193, 171, and 211. Post-eruptive arcades are present following the flare.",,1429.0,km/s,,45.0,4.0,100.0,True,2023-08-07 23:18:00+00:00,0,O,,SWPC_CAT,"SOHO: LASCO/C2, SOHO: LASCO/C3","2023-08-07T20:30:00-FLR-001, 2023-08-07T22:09:00-SEP-001, 2023-08-07T22:19:00-SEP-001, 2023-08-08T01:00:00-SEP-001, 2023-08-08T01:48:00-SEP-001, 2023-08-08T01:59:00-SEP-001, 2023-08-08T04:26:00-SEP-001",2023-08-07,2023,8,7,20,219,3,Very Fast,True
2023-08-08T12:00:00-CME-001,M2M_CATALOG,2023-08-08 12:00:00+00:00,,"This CME is visible to the west in SOHO LASCO C2/C3 and STEREO A COR2 coronagraph imagery. The source may be related to a small eruption/dimming near W50N03 starting around 2023-08-08T11:24Z. However, it's also possible the source is far-sided.",,648.0,km/s,,15.0,-21.0,0.0,True,2023-08-08 17:18:00+00:00,0,C,,Plane-of-sky,"SOHO: LASCO/C2, SOHO: LASCO/C3, STEREO A: SECCHI/COR2",,2023-08-08,2023,8,8,12,220,3,Fast,False
2023-08-08T18:24:00-CME-001,M2M_CATALOG,2023-08-08 18:24:00+00:00,,This CME is visible to the NE in SOHO LASCO C2/C3 and STEREO A COR2 coronagraph imagery. The source is likely far-sided as there are no source signatures visible on the Earth-facing disk.,,536.0,km/s,,17.0,20.0,0.0,True,2023-08-09 00:49:00+00:00,0,C,,Plane-of-sky,"SOHO: LASCO/C2, SOHO: LASCO/C3, STEREO A: SECCHI/COR2",,2023-08-08,2023,8,8,18,220,3,Fast,False
2023-08-08T22:00:00-CME-001,M2M_CATALOG,2023-08-08 22:00:00+00:00,,"This CME is visible to the W/NW in SOHO LASCO C2/C3, but is not visible in STEREO A COR2 imagery due to a data gap. The source is uncertain, but this event is possibly related to a small eruption seen in SDO AIA 131, 171, 193, 304 imagery near N18W40 starting around 2023-08-08T21:15Z. Dimming and an opening of field lines can be seen in SDO AIA 171 and 193 imagery, with post eruptive arcades starting around 22:40Z.",,504.0,km/s,,18.0,10.0,40.0,False,2023-08-09 03:53:00+00:00,0,C,,SWPC_CAT,"SOHO: LASCO/C2, SOHO: LASCO/C3",,2023-08-08,2023,8,8,22,220,3,Fast,False
2023-08-09T16:12:00-CME-001,M2M_CATALOG,2023-08-09 16:12:00+00:00,,"This CME is a partial halo visible to the W/SW in SOHO LASCO C2/C3 and STEREO A COR2 imagery. The source is an eruption visible from beyond the NW limb starting around 2023-08-09T15:24Z seen in SDO AIA 131, 171, 193, 304 imagery. It is possible that this eruption occurred from Active Region 13386, which rotated off the Earth-facing disk around 2023-08-07. The current longitude of this region is around 125 degrees.",,1103.0,km/s,,45.0,-36.0,125.0,True,2023-08-09 19:26:00+00:00,0,O,,SWPC_CAT,"SOHO: LASCO/C2, SOHO: LASCO/C3, STEREO A: SECCHI/COR2",,2023-08-09,2023,8,9,16,221,3,Very Fast,True
2023-08-09T16:36:00-CME-001,M2M_CATALOG,2023-08-09 16:36:00+00:00,,"This CME is visible to the west in SOHO LASCO C2/C3 and STEREO A COR2 coronagraph imagery. The source for this event is likely related to the back-sided source associated with CME: 2023-08-09T16:12Z, as there is an additional eruption beyond the NW limb starting around 2023-08-09T15:40Z seen in SDO AIA 131, 171, 193, 304 imagery. It is possible this eruption occurred from Active Region 13386 which rotated off the Earth-facing disk on 2023-08-07. This CME overlaps with CME: 2023-08-09T16:12Z.",,784.0,km/s,,42.0,-7.0,125.0,True,2023-08-09 21:06:00+00:00,0,C,,SWPC_CAT,"SOHO: LASCO/C2, SOHO: LASCO/C3, STEREO A: SECCHI/COR2",,2023-08-09,2023,8,9,16,221,3,Fast,False
2023-08-10T02:48:00-CME-001,M2M_CATALOG,2023-08-10 02:48:00+00:00,S20W80,CME visible in the SW of SOHO LASCO C2/C3. It is also visible in STEREO A COR2 after a data gap from 2023-08-09T19:09Z to 2023-08-10T04:23Z. Source is a C5.4 flare and eruption from AR 3398 in the SW mainly characterized as brightening seen in SDO AIA 131/193/304 and opening field lines seen in SDO AIA 171/193.,,625.0,km/s,,36.0,-24.0,80.0,True,2023-08-10 08:11:00+00:00,0,C,,SWPC_CAT,"SOHO: LASCO/C2, SOHO: LASCO/C3, STEREO A: SECCHI/COR2",2023-08-10T02:26:00-FLR-001,2023-08-10,2023,8,10,2,222,3,Fast,False
2023-08-10T05:48:00-CME-001,M2M_CATALOG,2023-08-10 05:48:00+00:00,,"This CME is seen to the S/SW in SOHO LASCO C2/C3, and STEREO A COR2. The source is an eruption of prominence material seen on the southern limb. This prominence material has been seen on the southeast limb for several days and can be seen lifting off in SDO AIA 304 starting at about 2023-08-10T04:37Z. Slim lines of brightening can be seen in SDO AIA 304 at 2023-08-10T05:54Z, indicating that either the filament wrapped around to the Earth-facing disk before erupting, or perhaps that some prominence material from the southern limb fell back to the solar surface on the Earth-facing disk. In either case, the location of this brightening at about S80W05 indicates that the resulting CME is traveling at a very southern latitude, well out of the ecliptic plane.",,543.0,km/s,,30.0,-63.0,-20.0,True,2023-08-10 12:31:00+00:00,0,C,,SWPC_CAT,"SOHO: LASCO/C2, SOHO: LASCO/C3, STEREO A: SECCHI/COR2",,2023-08-10,2023,8,10,5,222,3,Fast,False
2023-08-10T12:00:00-CME-001,M2M_CATALOG,2023-08-10 12:00:00+00:00,,"This CME is seen to the NE in SOHO LASCO C2/C3, and STEREO A COR2. The source is a rising loop and opening field lines seen on or beyond the NE limb in SDO AIA 171/193 starting at 2023-08-10T09:49Z. The loop opens at about 2023-08-10T11:26Z.",,590.0,km/s,,28.0,21.0,0.0,True,2023-08-10 18:09:00+00:00,0,C,,Plane-of-sky,"SOHO: LASCO/C2, SOHO: LASCO/C3, STEREO A: SECCHI/COR2",,2023-08-10,2023,8,10,12,222,3,Fast,False
2023-08-10T16:00:00-CME-001,M2M_CATALOG,2023-08-10 16:00:00+00:00,,"This CME is faintly visible as a partial halo in SOHO LASCO C2 and STEREO A COR2 coronagraph imagery. The source is likely far-sided as there are no source signatures on the Earth-facing disk. It is possible this CME is associated with previously numbered Active Region 13380, which rotated off the Earth-facing disk around 2023-08-04. The approximate longitude of this Active Region is estimated to be around -160 to -170 degrees.",,537.0,km/s,,39.0,-12.0,-166.0,True,2023-08-10 21:15:00+00:00,0,C,,SWPC_CAT,"SOHO: LASCO/C2, STEREO A: SECCHI/COR2",,2023-08-10,2023,8,10,16,222,3,Fast,False
2023-08-11T06:36:00-CME-001,M2M_CATALOG,2023-08-11 06:36:00+00:00,,"Bright CME seen in the east of SOHO LASCO C2/C3 and STEREO A COR2. The source eruption can be seen on the east limb in GOES SUVI 304 as a filament liftoff, with opening field lines also visible in GOES SUVI 171/195. The eruption is obscured by a gap in SDO AIA imagery. The eruption is visible on the east limb in available EUV imagery of the Earth-facing disk, but may extend just beyond the east limb.",,751.0,km/s,,32.0,3.0,-90.0,True,2023-08-11 11:21:00+00:00,0,C,,SWPC_CAT,"SOHO: LASCO/C2, SOHO: LASCO/C3, STEREO A: SECCHI/COR2",,2023-08-11,2023,8,11,6,223,3,Fast,False
2023-08-11T13:48:00-CME-001,M2M_CATALOG,2023-08-11 13:48:00+00:00,,"This CME is visible to the west in SOHO LASCO C2/C3 and STEREO A COR2 coronagraph imagery. The source is uncertain and likely far-sided, but it's possible this event is associated with a small eruption near Active Region 13391 (N21W90) starting around 2023-08-11T13:21Z as seen in SDO AIA 131, 171, 193, 304 imagery. This event overlaps with CME: 2023-08-11T09:48Z.",,517.0,km/s,,19.0,-3.0,0.0,True,2023-08-11 20:44:00+00:00,0,C,,Plane-of-sky,"SOHO: LASCO/C2, SOHO: LASCO/C3, STEREO A: SECCHI/COR2",,2023-08-11,2023,8,11,13,223,3,Fast,False
2023-08-13T16:09:00-CME-001,M2M_CATALOG,2023-08-13 16:09:00+00:00,,Asymmetric CME seen to the west in LASCO C2 directly following a data gap and STEREO A COR2. The source is a rising/erupting loop just beyond the southwestern limb as seen best in SDO 171.,,515.0,km/s,,31.0,-13.0,0.0,True,2023-08-13 23:07:00+00:00,0,C,,Plane-of-sky,"STEREO A: SECCHI/COR2, SOHO: LASCO/C2, SOHO: LASCO/C3",,2023-08-13,2023,8,13,16,225,3,Fast,False
2023-08-14T20:48:00-CME-001,M2M_CATALOG,2023-08-14 20:48:00+00:00,,This CME is visible to the E/NE in SOHO LASCO C2/C3 imagery but is not visible in STEREO A COR2 due to a data gap related to not having 24 hour telemetry coverage. The source is likely associated with an eruption and opening of field lines from or near Active Region 13405 (~N10E85) starting around 2023-08-14T20:30Z,,518.0,km/s,,45.0,19.0,-90.0,True,2023-08-15 03:08:00+00:00,0,C,,SWPC_CAT,"SOHO: LASCO/C2, SOHO: LASCO/C3",2023-08-14T20:30:00-FLR-001,2023-08-14,2023,8,14,20,226,3,Fast,False
2023-08-15T13:36:00-CME-001,M2M_CATALOG,2023-08-15 13:36:00+00:00,,This CME is visible to the SW in SOHO LASCO C2/C3 and STEREO A COR2 coronagraph imagery. The source is likely related to an opening of field lines and rising loop visible near or on the SW limb in GOES SUVI 284 starting around 2023-08-15T13:00Z.,,540.0,km/s,,33.0,-38.0,90.0,True,2023-08-15 20:44:00+00:00,0,C,,SWPC_CAT,"SOHO: LASCO/C2, SOHO: LASCO/C3, STEREO A: SECCHI/COR2",,2023-08-15,2023,8,15,13,227,3,Fast,False
2023-08-16T09:24:00-CME-001,M2M_CATALOG,2023-08-16 09:24:00+00:00,S05E45,This CME is visible to the E/SE in SOHO LASCO C2/C3 and STEREO A COR2 coronagraph imagery. The source may be related to the dimming visible near Active Region 13404 (S05E45) with subsequent field line movement visible near the eastern limb limb starting around 2023-08-16T07:15Z in SDO AIA 193 and GOES SUVI 284 imagery.,,667.0,km/s,,24.0,-5.0,-45.0,True,2023-08-16 14:24:00+00:00,0,C,,SWPC_CAT,"SOHO: LASCO/C2, SOHO: LASCO/C3, STEREO A: SECCHI/COR2",,2023-08-16,2023,8,16,9,228,3,Fast,False
2023-08-17T02:48:00-CME-001,M2M_CATALOG,2023-08-17 02:48:00+00:00,,"CME visible in the SW of SOHO LASCO C2/C3 and in STEREO A COR2. The source is a prominence eruption on the SW limb starting around 2023-08-17T02:15Z. The material can be seen lifting off in SDO AIA 193/304, opening field lines are visible in SDO AIA 171/193. The eruption is also visible on the SW limb in STEREO A EUV imagery. This is believed to be associated with a C3.6 flare from Active Region 3394 which rotated off the Earth-facing disk on 2023-08-15, situated around longitude 105-110 during this eruption. Slight elevation in GOES > 10 MeV, SOHO COSTEP proton flux, and STEREO A proton flux observed in the hours after this eruption, but these values remained below the threshold for an SEP event.",,859.0,km/s,,43.0,-26.0,105.0,True,2023-08-17 06:50:00+00:00,0,C,,SWPC_CAT,"SOHO: LASCO/C2, SOHO: LASCO/C3, STEREO A: SECCHI/COR2",2023-08-17T02:19:00-FLR-001,2023-08-17,2023,8,17,2,229,3,Fast,True
