event_id,catalog,start_time,source_location,note,cme_type,speed,speed_unit,direction,half_angle,latitude,longitude,most_accurate,analysis_time,level_of_data,analysis_type,measurement_pa,measurement_technique,instruments,linked_events,date,year,month,day,hour,day_of_year,quarter,speed_category,potentially_geoeffective
2024-08-19T16:24:00-CME-001,M2M_CATALOG,2024-08-19 16:24:00+00:00,,"This CME is visible to the south in SOHO LASCO C2, C3, and STEREO A COR2 imagery. The source is not clear. There is filament ejecta visible to the S/SE starting around 2024-08-20T16:45Z which isn't best for timing, however with limited stereoscopic viewpoints of the solar disk, it's possible there was an earlier eruption and the filament ejecta was seen later, this is very speculative though.",,1343.0,km/s,,15.0,-59.0,168.0,True,2024-08-19 18:50:00+00:00,0,O,,SWPC_CAT,"SOHO: LASCO/C2, SOHO: LASCO/C3, STEREO A: SECCHI/COR2",,2024-08-19,2024,8,19,16,232,3,Very Fast,True
2024-08-19T22:00:00-CME-001,M2M_CATALOG,2024-08-19 22:00:00+00:00,,The first of three overlapping CMEs seen to the West in SOHO LASCO C2/C3 and STEREO A COR2. The source is opening field lines from just beyond the West limb at an apparent latitude of S10 seen starting at 2024-08-19T21:49Z in SDO AIA 171/193 and GOES SUVI 284.,,589.0,km/s,,18.0,3.0,115.0,True,2024-08-20 03:56:00+00:00,1,C,,SWPC_CAT,"SOHO: LASCO/C2, SOHO: LASCO/C3, STEREO A: SECCHI/COR2",,2024-08-19,2024,8,19,22,232,3,Fast,False
2024-08-19T22:12:00-CME-001,M2M_CATALOG,2024-08-19 22:12:00+00:00,,"The second of three overlapping CMEs, seen to the Northwest in SOHO LASCO C2/C3 and STEREO A COR2. The source is wide but extremely faint opening field lines seen on or possibly just beyond the Northwest limb seen starting at 2024-08-19T21:03Z in SDO AIA 171 and GOES SUVI 284.",,533.0,km/s,,39.0,18.0,90.0,True,2024-08-20 04:49:00+00:00,1,C,,SWPC_CAT,"SOHO: LASCO/C2, SOHO: LASCO/C3, STEREO A: SECCHI/COR2",,2024-08-19,2024,8,19,22,232,3,Fast,False
2024-08-19T22:36:00-CME-001,M2M_CATALOG,2024-08-19 22:36:00+00:00,,"The third of three overlapping CMEs, seen to the Southwest in SOHO LASCO C2/C3 and STEREO A COR2. The source is widely and distinctly opening field lines from beyond the Southwest limb seen starting at 2024-08-19T21:54Z in SDO AIA 171/193 and GOES SUVI 284.",,513.0,km/s,,33.0,-27.0,120.0,True,2024-08-20 05:40:00+00:00,1,C,,SWPC_CAT,"SOHO: LASCO/C2, SOHO: LASCO/C3, STEREO A: SECCHI/COR2",,2024-08-19,2024,8,19,22,232,3,Fast,False
2024-08-20T07:24:00-CME-001,M2M_CATALOG,2024-08-20 07:24:00+00:00,,"Faint, fast CME seen to the E in SOHO LASCO C2/C3, STEREO COR2A is not in a data gap but does not observe this CME, likely due to the faint nature. The source for this CME is uncertain, and may only be observed in SDO AIA 171 around 2024-08-20T07:12Z as some dimming in the field lines over the SE limb.",,858.0,km/s,,23.0,-17.0,0.0,True,2024-08-20 11:39:00+00:00,0,C,,Plane-of-sky,"SOHO: LASCO/C2, SOHO: LASCO/C3",,2024-08-20,2024,8,20,7,233,3,Fast,True
2024-08-20T11:48:00-CME-001,M2M_CATALOG,2024-08-20 11:48:00+00:00,,"Wide CME first seen in the West by SOHO LASCO C2 beginning at 2024-08-20T11:48Z as well as in later frames by C3 and STERO A COR2. There is no clear source on the disk for this event, however some faint field line movement can be seen in GOES SUVI 284, so this is likely a far sided event. This CME partially overlaps with CME: 2024-08-20T12:12Z",,722.0,km/s,,33.0,-7.0,119.0,True,2024-08-20 16:31:00+00:00,0,C,,SWPC_CAT,"SOHO: LASCO/C2, SOHO: LASCO/C3, STEREO A: SECCHI/COR2",,2024-08-20,2024,8,20,11,233,3,Fast,False
2024-08-20T12:12:00-CME-001,M2M_CATALOG,2024-08-20 12:12:00+00:00,S30W120,"CME first seen in the SW by SOHO LASCO C2 beginning at 2024-08-20T12:12Z as well as in later frames by C3 and STERO A COR2. The source of this eruption is a filament eruption just beyond the West limb (approx. S30W120) as seen in STEREO A EUVI 304. Wide opening field lines can also be seen in SDO AIA 94, 171, 192 and GOES SUVI 284. This CME partially overlaps with CME: 2024-08-20T11:48Z.",,758.0,km/s,,33.0,-36.0,119.0,True,2024-08-20 16:50:00+00:00,0,C,,SWPC_CAT,"SOHO: LASCO/C2, SOHO: LASCO/C3, STEREO A: SECCHI/COR2",,2024-08-20,2024,8,20,12,233,3,Fast,False
2024-08-22T06:53:00-CME-001,M2M_CATALOG,2024-08-22 06:53:00+00:00,,"Bright loop CME first seen to the NW in STEREO A COR2 beginning at 2024-08-22T06:53Z. Data gap in SOHO LASCO imagery from 2024-08-21T23:36Z to 2024-08-22T07:24Z obstructed a few early frames of this CME in SOHO LASCO C2. The source of this event appears to be a large far-sided eruption, evidenced by wide opening field lines seen in GOES SUVI 284 beginning at approximately 2024-08-22T06:19Z and the possible remnants of filamentary material seen in GOES SUVI 304.",,570.0,km/s,,41.0,44.0,144.0,True,2024-08-22 13:17:00+00:00,1,C,,SWPC_CAT,"STEREO A: SECCHI/COR2, SOHO: LASCO/C2, SOHO: LASCO/C3",,2024-08-22,2024,8,22,6,235,3,Fast,False
2024-08-22T15:09:00-CME-001,M2M_CATALOG,2024-08-22 15:09:00+00:00,,"A very complex CME with a wider fainter partial halo component (possible shock) and a narrower complex-shaped brighter portion that potentially has several lobes. No corresponding source has been found on the Earth-facing disk. There was an equivalent of an M3 class flare seen by STIX instrument on the Solar Orbiter peaking at 2024-08-22T14:37Z with the very approximate longitude of 180, which could be the far sided possible source of this CME.",,917.0,km/s,,43.0,21.0,180.0,True,2024-08-22 18:31:00+00:00,0,C,,SWPC_CAT,"STEREO A: SECCHI/COR2, SOHO: LASCO/C2, SOHO: LASCO/C3",,2024-08-22,2024,8,22,15,235,3,Fast,True
2024-08-23T08:48:00-CME-001,M2M_CATALOG,2024-08-23 08:48:00+00:00,,This CME is visible to the north in SOHO LASCO C2/C3 and northwest in STEREO A COR2 imagery. The source is likely far-sided as there are no corresponding source signatures visible on the Earth-facing disk at the time of this event.,,562.0,km/s,,37.0,47.0,158.0,True,2024-08-23 14:42:00+00:00,0,C,,SWPC_CAT,"SOHO: LASCO/C2, SOHO: LASCO/C3, STEREO A: SECCHI/COR2",,2024-08-23,2024,8,23,8,236,3,Fast,False
2024-08-23T16:36:00-CME-001,M2M_CATALOG,2024-08-23 16:36:00+00:00,,"Fast, faint CME seen to the SW in SOHO LASCO C2/C3. The source appears to be jet-like filament eruptions on or around the west limb, best observed in GOES SUVI 284 at 2024-08-23T14:56Z, with a second one at 16:20Z less likely due to timing.",,868.0,km/s,,13.0,-44.0,0.0,True,2024-08-23 20:36:00+00:00,0,C,,Plane-of-sky,"SOHO: LASCO/C2, SOHO: LASCO/C3",,2024-08-23,2024,8,23,16,236,3,Fast,True
2024-08-26T12:12:00-CME-001,M2M_CATALOG,2024-08-26 12:12:00+00:00,,"Streamer blowout CME to the S/SE in SOHO LASCO C2, C3, and STEREO A COR2 imagery. The start time of the CME could be as early as ~10Z, as that's when the shape first starts appearing in difference imagery, however it doesn't quite start progressing out in the field of view until roughly 12:12Z. The source appears to be moving/opening field lines visible in GOES SUVI 284 in the SE quadrant of the Earth-facing disk with notable changes in the corona's structure over the course of several hours. Most notably, these changes are visible starting around 14:00Z. Brightening is visible on the disk starting around 15:00Z with continued restructuring of the corona for several hours after. Additionally, the CME structure appears to be visible in the field lines off the SE limb, fairly stationary as early as 2024-08-25T17:00Z and is released during this restructuring starting around 2024-08-26T12:00Z.",,571.0,km/s,,32.0,-64.0,-22.0,True,2024-08-26 21:03:00+00:00,0,C,,SWPC_CAT,"SOHO: LASCO/C2, SOHO: LASCO/C3, STEREO A: SECCHI/COR2",,2024-08-26,2024,8,26,12,239,3,Fast,False
2024-08-28T04:12:00-CME-001,M2M_CATALOG,2024-08-28 04:12:00+00:00,S10E90,"Bright CME first seen in the East by SOHO LASCO C2 beginning at 2024-08-28T04:12Z as well as by C3 and STEREO A COR2 in later frames. The source of this event is the eruption of a loop like filament sitting on or just beyond the East limb centered at approximately S10E90 as seen in SDO AIA, GOES SUVI and STEREO A EUVI 304. Field line opening is also visible in SDO AIA 171, 193, 211, GOES SUVI 284 and STEREO A EUVI 195, along with post eruptive arcades seen in SDO AIA 94 and 131. This filament erupted in two portions, the first appearing as a streamer outflow, followed by the main expulsion of material. In the coronagraphs, this appears as two leading edges, a further out one that is lopsided and faint and a closer in one that is more central and bright. Parameters of this event are based on the more central, brightest portion of this CME, as that is where the bulk of the material resides.",,758.0,km/s,,38.0,10.0,-95.0,True,2024-08-28 10:10:00+00:00,0,C,,SWPC_CAT,"SOHO: LASCO/C2, SOHO: LASCO/C3, STEREO A: SECCHI/COR2",,2024-08-28,2024,8,28,4,241,3,Fast,False
2024-08-28T11:48:00-CME-001,M2M_CATALOG,2024-08-28 11:48:00+00:00,,CME first seen in the NE by SOHO LASCO C2 beginning at 2024-08-28T11:48Z as well as by C3 and STEREO A COR2 in later frames. There is no clear source seen on the disk apart from some minor field line movement seen in the NE in SDO AIA 171. Event does not exhibit a clear and distinct leading edge.,,591.0,km/s,,15.0,22.0,0.0,True,2024-08-28 18:43:00+00:00,0,C,,Plane-of-sky,"SOHO: LASCO/C2, SOHO: LASCO/C3, STEREO A: SECCHI/COR2",,2024-08-28,2024,8,28,11,241,3,Fast,False
2024-08-30T12:53:00-CME-001,M2M_CATALOG,2024-08-30 12:53:00+00:00,S12E55,"Faint CME to the southeast which possibly consists of two lobes: an earlier, more eastern lobe, and a later, narrower, lobe, directed somewhat more to the south. The source of this CME is the fast opening of and movement of field lines in the corona behind the southeast limb directed, as well as dimming seen in SDO AIA 193 at 2024-08-30T12:27Z. This eruption was also associated with the M3.8 flare from Active Region 13806. There was also a slightly later, slower, eruption from the southeast limb (or from behind the limb), which is seen in SDO AIA 193 after 2024-08-30T12:30Z and which is characterized by a minor ejecta best seen in SDO AIA 304, followed by an opening of field lines behind the limb seen in AIA 171.",,573.0,km/s,,30.0,-5.0,-56.0,True,2024-08-30 18:56:00+00:00,0,C,,SWPC_CAT,"SOHO: LASCO/C2, SOHO: LASCO/C3, STEREO A: SECCHI/COR2",2024-08-30T12:13:00-FLR-001,2024-08-30,2024,8,30,12,243,3,Fast,False
2024-08-31T00:23:00-CME-001,M2M_CATALOG,2024-08-31 00:23:00+00:00,,"CME seen to the W in all coronagraphs, but best in STEREO COR2A. The source is not completely clear, and may be a part of some field line movement on/around the west limb in SDO AIA 171 beginning as early as 2024-08-30T18:22Z. This CME is notably extremely faint in SOHO imagery.",,999.0,km/s,,24.0,0.0,0.0,True,2024-08-31 04:00:00+00:00,0,C,,Plane-of-sky,"STEREO A: SECCHI/COR2, SOHO: LASCO/C2, SOHO: LASCO/C3",,2024-08-31,2024,8,31,0,244,3,Fast,True
2024-08-31T01:38:00-CME-001,M2M_CATALOG,2024-08-31 01:38:00+00:00,,"Bright CME seen to the NW in all coronagraphs. The source is far-sided, observed best as field line movement over the NW limb in SDO AIA 171 starting around 2024-08-30T23:42Z, with secondary more northern movement seen starting around 2024-08-31T00:12Z which likely resulted in 2024-08-31T00:53Z. This CME's parameters are difficult to pin down, due to an ongoing campaign with SOHO impacting available LASCO C2/C3 imagery for triangulation with STEREO COR2A.",,584.0,km/s,,27.0,5.0,105.0,True,2024-08-31 07:14:00+00:00,0,C,,SWPC_CAT,"STEREO A: SECCHI/COR2, SOHO: LASCO/C2, SOHO: LASCO/C3",,2024-08-31,2024,8,31,1,244,3,Fast,False
2024-08-31T12:23:00-CME-001,M2M_CATALOG,2024-08-31 12:23:00+00:00,,This asymmetrical shaped CME is visible to the NE in SOHO LASCO C3 and STEREO A COR2 imagery. There is a data gap in SOHO LASCO C2 imagery due to a campaign. The source appears to be moving/opening field lines from beyond the NE limb in SDO/AIA 171 and GOES SUVI 284 starting around 2024-08-31T11:09Z. Multiple loops are seen rising in SDO/AIA 171 which may contribute to the appearance of multiple fronts in coronagraph imagery.,,645.0,km/s,,41.0,30.0,-131.0,True,2024-08-31 17:28:00+00:00,0,C,,SWPC_CAT,"STEREO A: SECCHI/COR2, SOHO: LASCO/C3",,2024-08-31,2024,8,31,12,244,3,Fast,False
2024-09-01T12:23:00-CME-001,M2M_CATALOG,2024-09-01 12:23:00+00:00,S25E90,"Bright CME seen to the southeast in SOHO LASCO C2/C3 and STEREO A COR2. Source is a large eruption on the SE limb seen as brightening starting at 2024-09-01T11:06Z in SDO AIA 131, ejection of material at 11:18Z in SDO AIA 304, rapidly opening field lines seen beyond the limb starting at 11:30Z in SDO AIA 171/193. Slow rise and eventual ejection of two overlapping flux rope loops from the southeast limb seen starting as early as 2024-09-01T08:08Z in GOES SUVI 304. Long-duration M5.5 flare associated with brightening from post-eruptive arcades that spanned from S20-S30, as seen in SDO AIA and GOES SUVI imagery.",,1247.0,km/s,,50.0,-59.0,-68.0,True,2024-09-01 15:22:00+00:00,0,O,,StereoCAT,"STEREO A: SECCHI/COR2, SOHO: LASCO/C2, SOHO: LASCO/C3","2024-09-01T11:45:00-FLR-001, 2024-09-01T23:14:00-SEP-001",2024-09-01,2024,9,1,12,245,3,Very Fast,True
2024-09-01T19:36:00-CME-001,M2M_CATALOG,2024-09-01 19:36:00+00:00,,"Faint CME seen to the S/SE following the path of the 2024-09-01T12:23Z CME in SOHO LASCO C2, C3, and STEREO A COR2 imagery. No clear visible source in SDO/AIA or GOES/SUVI imagery.",,1077.0,km/s,,20.0,-58.0,-65.0,True,2024-09-01 23:35:00+00:00,0,O,,StereoCAT,"SOHO: LASCO/C2, SOHO: LASCO/C3, STEREO A: SECCHI/COR2",,2024-09-01,2024,9,1,19,245,3,Very Fast,True
2024-09-02T06:36:00-CME-001,M2M_CATALOG,2024-09-02 06:36:00+00:00,N15E65,"CME to the northeast in SOHO LASCO C2/C3 and STEREO A COR2. Source is an eruption close to the East limb, N15E65, seen starting at 2024-09-02T05:30Z in SDO AIA 171/193, followed by moving/opening field lines seen starting at 2024-09-02T06:03 in SDO AIA 171, as well as post-eruptive arcade starting at 2024-09-02T07:36Z.",,623.0,km/s,,32.0,30.0,-57.0,True,2024-09-02 13:38:00+00:00,1,C,,SWPC_CAT,"SOHO: LASCO/C2, SOHO: LASCO/C3, STEREO A: SECCHI/COR2",,2024-09-02,2024,9,2,6,246,3,Fast,False
2024-09-02T13:25:00-CME-001,M2M_CATALOG,2024-09-02 13:25:00+00:00,,"Narrow CME seen to the east in SOHO C2 and STEREO A, but more predominantly in SOHO imagery, later overlapping with CME:2024-09-02T14:00Z which is seen to the southeast. Seemingly associated with an eruption occurring just before the CME: 2024-09-02T14:00Z from near the same region or farther behind the limb with clear northward deflection, however, fitting for longitudes between 60-70 is poor as the leading edges in SOHO/STEREO A do not overlap well in time, suggesting that this CME is more far-sided than anticipated. Farther longitudes behind the eastern disk do show a stronger leading edge fit and triangulation.",,607.0,km/s,,16.0,8.0,-112.0,True,2024-09-02 19:34:00+00:00,0,C,,SWPC_CAT,"SOHO: LASCO/C2, SOHO: LASCO/C3, STEREO A: SECCHI/COR2",,2024-09-02,2024,9,2,13,246,3,Fast,False
2024-09-02T14:00:00-CME-001,M2M_CATALOG,2024-09-02 14:00:00+00:00,S17E62,"Wide CME seen to the southeast in SOHO C2, C3, and STEREO A COR2. Associated with a contributing portion of an M2.9-class flare and eruption near AR 3813 (S17E62) seen best in SDO 304/193 as a brightening and in 171/193 as brightening with moving field lines. GOES 284 also shows a large bulb-shaped mass emanating from off the southeast limb after the initial brightening.",,517.0,km/s,,31.0,-20.0,-61.0,True,2024-09-02 21:20:00+00:00,0,C,,SWPC_CAT,"SOHO: LASCO/C2, SOHO: LASCO/C3, STEREO A: SECCHI/COR2",2024-09-02T13:34:00-FLR-001,2024-09-02,2024,9,2,14,246,3,Fast,False
2024-09-03T08:12:00-CME-001,M2M_CATALOG,2024-09-03 08:12:00+00:00,,"Bright full asymmetric halo CME in SOHO and a partial northwestern halo in STEREO A, with a fainter but distinct shock front in addition to a very bright bulk. Its source is likely farsided and is indicated by the faint but very wide opening of field lines/restructuring of magnetic field far behind the northwest (extending faintly to southwest) limb, as seen in SDO 193/171 starting at 2024-09-03T08:18Z, also seen in STA EUV 195.",,1247.0,km/s,,45.0,12.0,144.0,True,2024-09-03 10:53:00+00:00,0,O,,SWPC_CAT,"SOHO: LASCO/C2, SOHO: LASCO/C3, STEREO A: SECCHI/COR2",2024-09-03T08:39:00-SEP-001,2024-09-03,2024,9,3,8,247,3,Very Fast,True
2024-09-03T14:48:00-CME-001,M2M_CATALOG,2024-09-03 14:48:00+00:00,,"CME first seen in the NW by SOHO LASCO C2 beginning at 2024-09-03T14:48Z as well as in later frames by SOHO LASCO C3. There is no STEREO A COR2 data available for this event due to an ongoing data gap beginning 03/14:38Z with one frame at 03/17:23Z. There is no clear source for this CME seen on the disk, however some minor field line movement can be seen beyond the NW limb in SDO AIA 171 leading to the possibility of this being a far sided event.",,533.0,km/s,,13.0,39.0,0.0,True,2024-09-03 22:11:00+00:00,0,C,,Plane-of-sky,"SOHO: LASCO/C2, SOHO: LASCO/C3",,2024-09-03,2024,9,3,14,247,3,Fast,False
2024-09-03T15:12:00-CME-001,M2M_CATALOG,2024-09-03 15:12:00+00:00,S18W54,"CME first seen in the SW by SOHO LASCO C2 beginning at 2024-09-03T15:12Z as well as by SOHO LASCO C3 and STEREO A COR2 in later frames. There is limited COR2A data available for this event due to a data gap from 03/14:38Z to 03/17:23Z. The source of this CME is an eruption from AR 3807 (S18W54) beginning at approximately 03/14:00Z as seen in SDO AIA 131, 193, 211 and STEREO A EUVI 195.",,573.0,km/s,,10.0,-27.0,59.0,True,2024-09-03 21:20:00+00:00,0,C,,SWPC_CAT,"SOHO: LASCO/C2, SOHO: LASCO/C3, STEREO A: SECCHI/COR2",,2024-09-03,2024,9,3,15,247,3,Fast,False
2024-09-03T20:12:00-CME-001,M2M_CATALOG,2024-09-03 20:12:00+00:00,N10E20,"Bright CME first seen in the NE by SOHO LASCO C2 beginning at 2024-09-03T20:12Z as well as by SOHO LASCO C3 and STEREO A COR2 in later frames. This event is partially obscured in STEREO A by a data gap from 03/14:38Z to 03/22:53Z. The source of this CME is an area of dimming spanning from N25E30 to N10E03 but is centered around N10E20. Although a majority of the dimming appears to be more central, there are field lines that appear to open more towards the NE as seen in SDO AIA 171 and 211.",,780.0,km/s,,24.0,24.0,-33.0,True,2024-09-04 00:58:00+00:00,0,C,,SWPC_CAT,"SOHO: LASCO/C2, SOHO: LASCO/C3, STEREO A: SECCHI/COR2",,2024-09-03,2024,9,3,20,247,3,Fast,False
2024-09-05T01:48:00-CME-001,M2M_CATALOG,2024-09-05 01:48:00+00:00,,"Faint loop CME seen to the northwest in SOHO C2/C3 then becoming more to the north with time. Also seen to the west-northwest in STEREO A COR2A. No obvious sources are seen on the Earth facing disk or off the northwestern limb, so this CME event is likely far-sided relative to the Sun-Earth line.",,684.0,km/s,,28.0,19.0,153.0,True,2024-09-05 06:36:00+00:00,0,C,,SWPC_CAT,"SOHO: LASCO/C2, SOHO: LASCO/C3, STEREO A: SECCHI/COR2",,2024-09-05,2024,9,5,1,249,3,Fast,False
2024-09-05T07:24:00-CME-001,M2M_CATALOG,2024-09-05 07:24:00+00:00,,"Fairly symmetrical halo CME with brighter portions to the NW in SOHO and NE in STEREO A, first seen around 2024-09-05T07:24Z in SOHO C2. The eruption is very likely on the far-side relative to the Earth-facing solar disk as evidenced by flickering field lines seen best in SDO AIA 193/171 and GOES SUVI 284 far off the northwest and southwest limbs seen around 2024-09-05T07:15Z.",,1577.0,km/s,,55.0,8.0,180.0,True,2024-09-05 09:13:00+00:00,0,O,,SWPC_CAT,"SOHO: LASCO/C2, SOHO: LASCO/C3, STEREO A: SECCHI/COR2",2024-09-05T15:51:00-SEP-001,2024-09-05,2024,9,5,7,249,3,Very Fast,True
2024-09-05T11:23:00-CME-001,M2M_CATALOG,2024-09-05 11:23:00+00:00,,CME seen to the west. No source has been found on disk in EUV imagery. There is a minor eruptive activity seen on/behind the limb in EUV imagery. There are multiple secondary fronts following the initial front.,,590.0,km/s,,24.0,10.0,53.0,True,2024-09-05 16:37:00+00:00,0,C,,SWPC_CAT,"STEREO A: SECCHI/COR2, SOHO: LASCO/C2, SOHO: LASCO/C3",,2024-09-05,2024,9,5,11,249,3,Fast,False
2024-09-06T11:48:00-CME-001,M2M_CATALOG,2024-09-06 11:48:00+00:00,,"Narrow, faint CME seen to the southwest in SOHO C2/STEREO A COR2 which may be associated with changes in departing Active Region 3807 (~W97) around 2024-09-06T11:00Z or so as seen in GOES SUVI 284.",,592.0,km/s,,10.0,-36.0,93.0,True,2024-09-06 18:34:00+00:00,0,C,,SWPC_CAT,"SOHO: LASCO/C2, SOHO: LASCO/C3, STEREO A: SECCHI/COR2",,2024-09-06,2024,9,6,11,250,3,Fast,False
2024-09-06T14:48:00-CME-001,M2M_CATALOG,2024-09-06 14:48:00+00:00,S12W46,Minor puff-like CME seen to the northwest in SOHO C2 and C3 and not seen with available STEREO A COR2 frames due to a data gap. Likely associated with a minor eruption seen near AR3806 (S12W46) seen best in GOES SUVI 304 with northward deflection.,,528.0,km/s,,17.0,20.0,49.0,True,2024-09-06 21:09:00+00:00,0,C,,SWPC_CAT,"SOHO: LASCO/C2, SOHO: LASCO/C3",,2024-09-06,2024,9,6,14,250,3,Fast,False
2024-09-06T18:00:00-CME-001,M2M_CATALOG,2024-09-06 18:00:00+00:00,,"Fast, narrow CME seen to the south-southwest in SOHO C2, C3 and STEREO A COR2. The source is not clear, however, one potential source candidate is a filament eruption and surge eruption near the southern portion of the central meridian; it takes place near 16:05Z, which is fairly early compared to when the CME is first seen. Some weakly opening field lines seen best in GOES SUVI 284 just before 18:00Z off the south-southwestern limb could additionally be associated with this CME.",,634.0,km/s,,14.0,-62.0,66.0,True,2024-09-06 23:49:00+00:00,0,C,,SWPC_CAT,"SOHO: LASCO/C2, SOHO: LASCO/C3, STEREO A: SECCHI/COR2",,2024-09-06,2024,9,6,18,250,3,Fast,False
2024-09-08T01:36:00-CME-001,M2M_CATALOG,2024-09-08 01:36:00+00:00,N14W20,"This CME is visible to the NW in SOHO LASCO C2, C3, and as a partial halo in STEREO A COR2 imagery. The source is a filament eruption centered near N14W20 which deflects NW as it erupts based on SDO/AIA 304 imagery. The eruption begins around 2024-09-08T00:00Z. A faint EUV wave is visible traveling N/NE of the source location despite the filament material deflecting NW as seen in SDO/AIA 193 and GOES SUVI 284. This eruption is also visible in STEREO A EUVI 304.",,626.0,km/s,,41.0,22.0,23.0,True,2024-09-08 06:39:00+00:00,0,C,,SWPC_CAT,"SOHO: LASCO/C2, SOHO: LASCO/C3, STEREO A: SECCHI/COR2","2024-09-10T21:00:00-IPS-001, 2024-09-11T14:18:00-IPS-001",2024-09-08,2024,9,8,1,252,3,Fast,False
2024-09-08T10:24:00-CME-001,M2M_CATALOG,2024-09-08 10:24:00+00:00,,"Narrow CME seen to the W in C2 and STEREO A COR2. Not visible in C3. Leading edge appears brighter in STEREO A COR2 than in SOHO LASCO. Source is opening field lines seen at 2023-09-08T09:15Z just beyond the limb as seen in STEREO-A EUVI 304 and 195 imagery, at about S10.",,842.0,km/s,,20.0,6.0,148.0,True,2024-09-08 14:11:00+00:00,1,C,,SWPC_CAT,"SOHO: LASCO/C2, STEREO A: SECCHI/COR2",,2024-09-08,2024,9,8,10,252,3,Fast,True
2024-09-09T01:25:00-CME-001,M2M_CATALOG,2024-09-09 01:25:00+00:00,S05W89,"Large, bright lightbulb CME to the west in SOHO LASCO C2, C3, and STEREO A COR2 imagery. The source appears to be a long duration M1.0 flare from AR13806 (~S05W89). Moving/opening field lines are visible in SDO/AIA 171 and 193 starting around 2024-09-09T00:24Z along the western limb with post-eruptive arcades visible starting around 2024-09-09T02:24Z. The eruption is also visible in GOES SUVI before an eclipse occurs and in STEREO A EUVI 304 and 195 imagery.",,957.0,km/s,,45.0,13.0,81.0,True,2024-09-09 06:16:00+00:00,0,C,,StereoCAT,"SOHO: LASCO/C2, SOHO: LASCO/C3, STEREO A: SECCHI/COR2",2024-09-09T00:57:00-FLR-001,2024-09-09,2024,9,9,1,253,3,Fast,True
2024-09-09T05:23:00-CME-001,M2M_CATALOG,2024-09-09 05:23:00+00:00,,Large bright halo CME with bulk to the NE in STEREO A COR2 and following a data gap in SOHO LASCO C2 and C3 imagery. The source appears to be beyond the eastern limb in SDO/AIA 193 and 211 starting around 2024-09-09T05:00Z with a visible rising loop and clear moving/opening field lines. There is a dimming/reconstruction/EUV wave in the coronal material along the limb. Possible filament material is visible in SDO/AIA 171 and 304 briefly around 2024-09-09T05:10Z. Moving field lines are briefly visible in GOES SUVI 284 before an eclipse occurs.,,1452.0,km/s,,45.0,18.0,-133.0,True,2024-09-09 07:33:00+00:00,0,O,,SWPC_CAT,"STEREO A: SECCHI/COR2, SOHO: LASCO/C2, SOHO: LASCO/C3","2024-09-09T07:58:00-SEP-001, 2024-09-09T08:50:00-SEP-001, 2024-09-09T16:35:00-SEP-001",2024-09-09,2024,9,9,5,253,3,Very Fast,True
2024-09-10T00:23:00-CME-001,M2M_CATALOG,2024-09-10 00:23:00+00:00,N15E10,"Wide CME associated with a long duration M1.2-class flare from Active Region 3814 (N15E10) seen predominantly to the northeast in SOHO C2 imagery and east-northeast in STEREO A COR2. The eruptive signature is seen as a large-broad scale destabilization seen as a surge-like brightening in SDO AIA 131, opening and brightening field lines in GOES SUVI 284 with additional dimming and an EUV wave to the north, and bright, high post-eruptive arcades seen best in SDO AIA 171/193/304. There is a data gap in real-time in SOHO LASCO C2/C3 at the start of the CME from approx. 2024-09-09T21:48Z to 2024-09-10T01:25Z",,755.0,km/s,,43.0,26.0,-5.0,True,2024-09-10 04:37:00+00:00,0,C,,SWPC_CAT,"STEREO A: SECCHI/COR2, SOHO: LASCO/C2, SOHO: LASCO/C3","2024-09-09T23:47:00-FLR-001, 2024-09-12T02:53:00-IPS-001, 2024-09-12T09:00:00-GST-001, 2024-09-12T11:22:00-IPS-001, 2024-09-12T18:40:00-MPC-001, 2024-09-13T16:35:00-RBE-001",2024-09-10,2024,9,10,0,254,3,Fast,False
